[
  {
    "model": "gpt-5.6-luna",
    "model_version": "2026-07-09",
    "offering_type": "GlobalStandard",
    "region": "eastus2",
    "api_path": "CAPI",
    "streaming_mode": "streaming",
    "input_token_bucket": "<2K",
    "output_token_bucket": "<500",
    "cache_hit_rate": null,
    "metric": "TTFT_P95",
    "value": 2800,
    "sample_size": 1200,
    "ingestion_time": "2026-09-03T00:00:00Z"
  },
  {
    "model": "gpt-5.6-luna",
    "model_version": "2026-07-09",
    "offering_type": "GlobalStandard",
    "region": "eastus2",
    "api_path": "CAPI",
    "streaming_mode": "streaming",
    "input_token_bucket": "<2K",
    "output_token_bucket": ">=500",
    "cache_hit_rate": null,
    "metric": "TTFT_P95",
    "value": 3600,
    "sample_size": 1255,
    "ingestion_time": "2026-09-03T00:00:00Z"
  },
  {
    "model": "gpt-5.6-luna",
    "model_version": "2026-07-09",
    "offering_type": "GlobalStandard",
    "region": "eastus2",
    "api_path": "CAPI",
    "streaming_mode": "streaming",
    "input_token_bucket": "2-8K",
    "output_token_bucket": "<500",
    "cache_hit_rate": null,
    "metric": "TTFT_P95",
    "value": 4300,
    "sample_size": 1340,
    "ingestion_time": "2026-09-03T00:00:00Z"
  },
  {
    "model": "gpt-5.6-luna",
    "model_version": "2026-07-09",
    "offering_type": "GlobalStandard",
    "region": "eastus2",
    "api_path": "CAPI",
    "streaming_mode": "streaming",
    "input_token_bucket": "2-8K",
    "output_token_bucket": ">=500",
    "cache_hit_rate": null,
    "metric": "TTFT_P95",
    "value": 5100,
    "sample_size": 1395,
    "ingestion_time": "2026-09-03T00:00:00Z"
  },
  {
    "model": "gpt-5.6-luna",
    "model_version": "2026-07-09",
    "offering_type": "GlobalStandard",
    "region": "eastus2",
    "api_path": "CAPI",
    "streaming_mode": "streaming",
    "input_token_bucket": "8-16K",
    "output_token_bucket": "<500",
    "cache_hit_rate": null,
    "metric": "TTFT_P95",
    "value": 6200,
    "sample_size": 1480,
    "ingestion_time": "2026-09-03T00:00:00Z"
  },
  {
    "model": "gpt-5.6-luna",
    "model_version": "2026-07-09",
    "offering_type": "GlobalStandard",
    "region": "eastus2",
    "api_path": "CAPI",
    "streaming_mode": "streaming",
    "input_token_bucket": "8-16K",
    "output_token_bucket": ">=500",
    "cache_hit_rate": null,
    "metric": "TTFT_P95",
    "value": 7000,
    "sample_size": 1535,
    "ingestion_time": "2026-09-03T00:00:00Z"
  },
  {
    "model": "gpt-5.6-luna",
    "model_version": "2026-07-09",
    "offering_type": "GlobalStandard",
    "region": "eastus2",
    "api_path": "CAPI",
    "streaming_mode": "streaming",
    "input_token_bucket": ">=16K",
    "output_token_bucket": "<500",
    "cache_hit_rate": null,
    "metric": "TTFT_P95",
    "value": 9200,
    "sample_size": 1620,
    "ingestion_time": "2026-09-03T00:00:00Z"
  },
  {
    "model": "gpt-5.6-luna",
    "model_version": "2026-07-09",
    "offering_type": "GlobalStandard",
    "region": "eastus2",
    "api_path": "CAPI",
    "streaming_mode": "streaming",
    "input_token_bucket": ">=16K",
    "output_token_bucket": ">=500",
    "cache_hit_rate": null,
    "metric": "TTFT_P95",
    "value": 10400,
    "sample_size": 1675,
    "ingestion_time": "2026-09-03T00:00:00Z"
  },
  {
    "model": "gpt-4.1-mini",
    "model_version": "2025-04-14",
    "offering_type": "GlobalStandard",
    "region": "eastus2",
    "api_path": "CAPI",
    "streaming_mode": "streaming",
    "input_token_bucket": "<2K",
    "output_token_bucket": "<500",
    "cache_hit_rate": null,
    "metric": "TTFT_P95",
    "value": 2016,
    "sample_size": 1560,
    "ingestion_time": "2026-09-03T00:00:00Z"
  },
  {
    "model": "gpt-4.1-mini",
    "model_version": "2025-04-14",
    "offering_type": "GlobalStandard",
    "region": "eastus2",
    "api_path": "CAPI",
    "streaming_mode": "streaming",
    "input_token_bucket": "<2K",
    "output_token_bucket": ">=500",
    "cache_hit_rate": null,
    "metric": "TTFT_P95",
    "value": 2592,
    "sample_size": 1615,
    "ingestion_time": "2026-09-03T00:00:00Z"
  },
  {
    "model": "gpt-4.1-mini",
    "model_version": "2025-04-14",
    "offering_type": "GlobalStandard",
    "region": "eastus2",
    "api_path": "CAPI",
    "streaming_mode": "streaming",
    "input_token_bucket": "2-8K",
    "output_token_bucket": "<500",
    "cache_hit_rate": null,
    "metric": "TTFT_P95",
    "value": 3096,
    "sample_size": 1700,
    "ingestion_time": "2026-09-03T00:00:00Z"
  },
  {
    "model": "gpt-4.1-mini",
    "model_version": "2025-04-14",
    "offering_type": "GlobalStandard",
    "region": "eastus2",
    "api_path": "CAPI",
    "streaming_mode": "streaming",
    "input_token_bucket": "2-8K",
    "output_token_bucket": ">=500",
    "cache_hit_rate": null,
    "metric": "TTFT_P95",
    "value": 3672,
    "sample_size": 1755,
    "ingestion_time": "2026-09-03T00:00:00Z"
  },
  {
    "model": "gpt-4.1-mini",
    "model_version": "2025-04-14",
    "offering_type": "GlobalStandard",
    "region": "eastus2",
    "api_path": "CAPI",
    "streaming_mode": "streaming",
    "input_token_bucket": "8-16K",
    "output_token_bucket": "<500",
    "cache_hit_rate": null,
    "metric": "TTFT_P95",
    "value": 4464,
    "sample_size": 1840,
    "ingestion_time": "2026-09-03T00:00:00Z"
  },
  {
    "model": "gpt-4.1-mini",
    "model_version": "2025-04-14",
    "offering_type": "GlobalStandard",
    "region": "eastus2",
    "api_path": "CAPI",
    "streaming_mode": "streaming",
    "input_token_bucket": "8-16K",
    "output_token_bucket": ">=500",
    "cache_hit_rate": null,
    "metric": "TTFT_P95",
    "value": 5040,
    "sample_size": 1895,
    "ingestion_time": "2026-09-03T00:00:00Z"
  },
  {
    "model": "gpt-4.1-mini",
    "model_version": "2025-04-14",
    "offering_type": "GlobalStandard",
    "region": "eastus2",
    "api_path": "CAPI",
    "streaming_mode": "streaming",
    "input_token_bucket": ">=16K",
    "output_token_bucket": "<500",
    "cache_hit_rate": null,
    "metric": "TTFT_P95",
    "value": 6624,
    "sample_size": 1980,
    "ingestion_time": "2026-09-03T00:00:00Z"
  },
  {
    "model": "gpt-4.1-mini",
    "model_version": "2025-04-14",
    "offering_type": "GlobalStandard",
    "region": "eastus2",
    "api_path": "CAPI",
    "streaming_mode": "streaming",
    "input_token_bucket": ">=16K",
    "output_token_bucket": ">=500",
    "cache_hit_rate": null,
    "metric": "TTFT_P95",
    "value": 7488,
    "sample_size": 2035,
    "ingestion_time": "2026-09-03T00:00:00Z"
  },
  {
    "model": "gpt-5.6-luna",
    "model_version": "2026-07-09",
    "offering_type": "GlobalStandard",
    "region": "eastus2",
    "api_path": "CAPI",
    "streaming_mode": "streaming",
    "input_token_bucket": "<2K",
    "output_token_bucket": "<500",
    "cache_hit_rate": null,
    "metric": "TBT_P95",
    "value": 45,
    "sample_size": 1200,
    "ingestion_time": "2026-09-03T00:00:00Z"
  },
  {
    "model": "gpt-5.6-luna",
    "model_version": "2026-07-09",
    "offering_type": "GlobalStandard",
    "region": "eastus2",
    "api_path": "CAPI",
    "streaming_mode": "streaming",
    "input_token_bucket": "<2K",
    "output_token_bucket": ">=500",
    "cache_hit_rate": null,
    "metric": "TBT_P95",
    "value": 50,
    "sample_size": 1255,
    "ingestion_time": "2026-09-03T00:00:00Z"
  },
  {
    "model": "gpt-5.6-luna",
    "model_version": "2026-07-09",
    "offering_type": "GlobalStandard",
    "region": "eastus2",
    "api_path": "CAPI",
    "streaming_mode": "streaming",
    "input_token_bucket": "2-8K",
    "output_token_bucket": "<500",
    "cache_hit_rate": null,
    "metric": "TBT_P95",
    "value": 55,
    "sample_size": 1340,
    "ingestion_time": "2026-09-03T00:00:00Z"
  },
  {
    "model": "gpt-5.6-luna",
    "model_version": "2026-07-09",
    "offering_type": "GlobalStandard",
    "region": "eastus2",
    "api_path": "CAPI",
    "streaming_mode": "streaming",
    "input_token_bucket": "2-8K",
    "output_token_bucket": ">=500",
    "cache_hit_rate": null,
    "metric": "TBT_P95",
    "value": 65,
    "sample_size": 1395,
    "ingestion_time": "2026-09-03T00:00:00Z"
  },
  {
    "model": "gpt-5.6-luna",
    "model_version": "2026-07-09",
    "offering_type": "GlobalStandard",
    "region": "eastus2",
    "api_path": "CAPI",
    "streaming_mode": "streaming",
    "input_token_bucket": "8-16K",
    "output_token_bucket": "<500",
    "cache_hit_rate": null,
    "metric": "TBT_P95",
    "value": 75,
    "sample_size": 1480,
    "ingestion_time": "2026-09-03T00:00:00Z"
  },
  {
    "model": "gpt-5.6-luna",
    "model_version": "2026-07-09",
    "offering_type": "GlobalStandard",
    "region": "eastus2",
    "api_path": "CAPI",
    "streaming_mode": "streaming",
    "input_token_bucket": "8-16K",
    "output_token_bucket": ">=500",
    "cache_hit_rate": null,
    "metric": "TBT_P95",
    "value": 90,
    "sample_size": 1535,
    "ingestion_time": "2026-09-03T00:00:00Z"
  },
  {
    "model": "gpt-5.6-luna",
    "model_version": "2026-07-09",
    "offering_type": "GlobalStandard",
    "region": "eastus2",
    "api_path": "CAPI",
    "streaming_mode": "streaming",
    "input_token_bucket": ">=16K",
    "output_token_bucket": "<500",
    "cache_hit_rate": null,
    "metric": "TBT_P95",
    "value": 105,
    "sample_size": 1620,
    "ingestion_time": "2026-09-03T00:00:00Z"
  },
  {
    "model": "gpt-5.6-luna",
    "model_version": "2026-07-09",
    "offering_type": "GlobalStandard",
    "region": "eastus2",
    "api_path": "CAPI",
    "streaming_mode": "streaming",
    "input_token_bucket": ">=16K",
    "output_token_bucket": ">=500",
    "cache_hit_rate": null,
    "metric": "TBT_P95",
    "value": 125,
    "sample_size": 1675,
    "ingestion_time": "2026-09-03T00:00:00Z"
  },
  {
    "model": "gpt-4.1-mini",
    "model_version": "2025-04-14",
    "offering_type": "GlobalStandard",
    "region": "eastus2",
    "api_path": "CAPI",
    "streaming_mode": "streaming",